{"$schema":"https://json-schema.org/draft/2020-12/schema","title":"Continuity Works Facility Archetype","type":"object","required":["archetype_id","version","family","facility_type","purpose","required_modules","allowed_corporate_languages","site_zones","recognition","distinction","circulation","vanilla_representation"],"properties":{"archetype_id":{"type":"string","pattern":"^[a-z0-9_.-]+:archetype/[A-Za-z0-9_./-]+$"},"version":{"type":"integer","minimum":1},"family":{"type":"string"},"facility_type":{"type":"string"},"scale_tiers":{"type":"array","items":{"type":"string"}},"purpose":{"type":"string","minLength":1},"required_modules":{"type":"array","items":{"type":"string"},"minItems":1},"optional_modules":{"type":"array","items":{"type":"string"}},"allowed_corporate_languages":{"type":"array","items":{"type":"string"},"minItems":1},"site_zones":{"type":"array","items":{"type":"object","required":["id","role"]},"minItems":1},"recognition":{"type":"object","required":["required_signatures","minimum_required_fraction"],"properties":{"required_signatures":{"type":"array","items":{"type":"string"},"minItems":1,"uniqueItems":true},"supporting_signatures":{"type":"array","items":{"type":"string"}},"minimum_required_fraction":{"type":"number","minimum":0,"maximum":1}}},"distinction":{"type":"object","required":["not_confusable_with","rules"],"properties":{"not_confusable_with":{"type":"array","items":{"type":"string"}},"rules":{"type":"array","items":{"type":"string"},"minItems":1}}},"circulation":{"type":"object"},"vanilla_representation":{"type":"object"}}}
