{"archetype_id":"continuityworks:archetype/highway_travel_stop","version":1,"family":"fuel_petroleum","facility_type":"travel_stop","scale_tiers":["medium","large"],"purpose":"Expanded highway fuel stop with separate customer building, larger fueling field, and heavy-vehicle accommodation.","required_modules":["continuityworks:module/fuel_canopy_13x5x9","continuityworks:module/pump_island_3x3x5","continuityworks:module/roadside_pylon_3x9x3","continuityworks:module/standard_room_9x5x9","continuityworks:module/loading_gantry_9x6x7"],"optional_modules":["continuityworks:module/utility_service_9x5x9"],"allowed_corporate_languages":["continuityworks:corporate/northstar_fuel","continuityworks:corporate/frontier_cooperative"],"site_zones":[{"id":"highway_frontage","role":"identity"},{"id":"retail_forecourt","role":"public_fueling"},{"id":"store","role":"public_building"},{"id":"truck_zone","role":"heavy_vehicle_fueling"},{"id":"parking","role":"dwell"}],"recognition":{"required_signatures":["fuel_canopy","multiple_pump_islands","large_storefront","roadside_pylon","truck_fueling_zone"],"supporting_signatures":["parking_field","service_yard","secondary_canopy"],"minimum_required_fraction":1.0},"distinction":{"not_confusable_with":["continuityworks:archetype/rural_gas_station","continuityworks:archetype/truck_fuel_terminal"],"rules":["Must read larger than a rural gas station through fueling capacity and vehicle circulation.","Truck/fleet fueling is spatially separated from the primary customer storefront.","Retail frontage remains visually stronger than industrial storage."]},"circulation":{"public_vehicle":"multi_access_loop","heavy_vehicle":"wide_pull_through","pedestrian":"protected_storefront_edge"},"vanilla_representation":{"block_policy":"vanilla_only","emphasis":"silhouette_and_zone_legibility"}}
