{"archetype_id":"continuityworks:archetype/crude_oil_well_pad","version":1,"family":"fuel_petroleum","facility_type":"crude_extraction","scale_tiers":["small","medium"],"purpose":"Remote crude-oil extraction pad centered on recognizable pumping equipment, collection piping, storage, and a small control/service enclosure.","required_modules":["continuityworks:module/pumpjack_9x8x9","continuityworks:module/storage_tank_9x7x9","continuityworks:module/pipe_rack_5x5x13","continuityworks:module/utility_service_9x5x9"],"optional_modules":[],"allowed_corporate_languages":["continuityworks:corporate/iron_mesa_energy","continuityworks:corporate/atlas_basin_refining"],"site_zones":[{"id":"wellhead","role":"extraction"},{"id":"collection","role":"piping"},{"id":"storage","role":"temporary_bulk_storage"},{"id":"control","role":"service"},{"id":"access","role":"maintenance"}],"recognition":{"required_signatures":["pumpjack","open_equipment_pad","crude_storage","visible_product_piping"],"supporting_signatures":["control_shed","perimeter_fence","service_road"],"minimum_required_fraction":1.0},"distinction":{"not_confusable_with":["continuityworks:archetype/compact_diesel_refinery","continuityworks:archetype/bulk_tank_farm"],"rules":["Extraction equipment must be the primary silhouette; enclosed buildings remain secondary.","The site must not contain a dense cluster of process columns characteristic of a refinery.","Storage is limited and subordinate to the extraction machinery."]},"circulation":{"service_vehicle":"single_access_pad","pedestrian":"maintenance_only","public":"none"},"vanilla_representation":{"block_policy":"vanilla_only","emphasis":"silhouette_and_zone_legibility"}}
