{"archetype_id":"continuityworks:archetype/truck_fuel_terminal","version":1,"family":"fuel_petroleum","facility_type":"fuel_distribution","scale_tiers":["medium","large"],"purpose":"Bulk fuel distribution terminal focused on tank storage, pipe transfer, and repeated truck loading bays rather than retail or processing.","required_modules":["continuityworks:module/storage_tank_9x7x9","continuityworks:module/pipe_rack_5x5x13","continuityworks:module/loading_gantry_9x6x7","continuityworks:module/utility_service_9x5x9"],"optional_modules":["continuityworks:module/roadside_pylon_3x9x3"],"allowed_corporate_languages":["continuityworks:corporate/northstar_fuel","continuityworks:corporate/iron_mesa_energy","continuityworks:corporate/atlas_basin_refining"],"site_zones":[{"id":"tankage","role":"storage"},{"id":"loading_rack","role":"distribution"},{"id":"queue","role":"heavy_vehicle_staging"},{"id":"operations","role":"control"}],"recognition":{"required_signatures":["bulk_tanks","multiple_loading_bays","pipe_header","controlled_vehicle_gate"],"supporting_signatures":["operations_building","fleet_queue","security_fence"],"minimum_required_fraction":1.0},"distinction":{"not_confusable_with":["continuityworks:archetype/highway_travel_stop","continuityworks:archetype/bulk_tank_farm"],"rules":["Loading gantries and heavy-vehicle lanes must dominate the road-facing operational zone.","No customer pump-island canopy or convenience-store frontage is permitted.","Storage supports distribution throughput rather than acting as the sole visual identity."]},"circulation":{"heavy_vehicle":"parallel_or_pull_through_bays","service_vehicle":"tank_access","public":"none"},"vanilla_representation":{"block_policy":"vanilla_only","emphasis":"silhouette_and_zone_legibility"}}
