{"archetype_id":"continuityworks:archetype/bulk_tank_farm","version":1,"family":"fuel_petroleum","facility_type":"bulk_storage","scale_tiers":["medium","large"],"purpose":"Organized bulk-liquid storage compound characterized by repeated tanks, containment, transfer piping, and controlled loading access.","required_modules":["continuityworks:module/storage_tank_9x7x9","continuityworks:module/pipe_rack_5x5x13","continuityworks:module/loading_gantry_9x6x7","continuityworks:module/utility_service_9x5x9"],"optional_modules":[],"allowed_corporate_languages":["continuityworks:corporate/iron_mesa_energy","continuityworks:corporate/atlas_basin_refining"],"site_zones":[{"id":"tank_blocks","role":"storage"},{"id":"containment","role":"safety_boundary"},{"id":"transfer","role":"piping"},{"id":"loading","role":"distribution"},{"id":"control","role":"operations"}],"recognition":{"required_signatures":["repeated_storage_tanks","containment_perimeter","pipe_header","loading_point"],"supporting_signatures":["control_building","security_fence","service_lanes"],"minimum_required_fraction":1.0},"distinction":{"not_confusable_with":["continuityworks:archetype/compact_diesel_refinery","continuityworks:archetype/crude_oil_well_pad"],"rules":["Repeated storage vessels must dominate the composition.","Process columns and flare systems are absent or visually subordinate.","Tanks should be organized in a legible row/grid rather than refinery-like mixed density."]},"circulation":{"heavy_vehicle":"controlled_pull_through","service_vehicle":"tank_access_lanes","public":"none"},"vanilla_representation":{"block_policy":"vanilla_only","emphasis":"silhouette_and_zone_legibility"}}
