{"archetype_id":"continuityworks:archetype/compact_diesel_refinery","version":1,"family":"fuel_petroleum","facility_type":"fuel_refining","scale_tiers":["medium","large"],"purpose":"Compact petroleum-processing campus with visible process columns, interconnected pipe racks, product storage, flare system, and loading interface.","required_modules":["continuityworks:module/process_column_5x16x5","continuityworks:module/pipe_rack_5x5x13","continuityworks:module/storage_tank_9x7x9","continuityworks:module/flare_stack_3x20x3","continuityworks:module/loading_gantry_9x6x7","continuityworks:module/utility_service_9x5x9"],"optional_modules":[],"allowed_corporate_languages":["continuityworks:corporate/iron_mesa_energy","continuityworks:corporate/atlas_basin_refining"],"site_zones":[{"id":"process_core","role":"conversion"},{"id":"tankage","role":"feed_and_product_storage"},{"id":"utility","role":"support"},{"id":"loading","role":"distribution"},{"id":"flare_zone","role":"safety_system"}],"recognition":{"required_signatures":["process_columns","dense_pipe_network","product_tanks","flare_stack","loading_gantry"],"supporting_signatures":["control_building","utility_yard","perimeter_security"],"minimum_required_fraction":1.0},"distinction":{"not_confusable_with":["continuityworks:archetype/bulk_tank_farm","continuityworks:archetype/crude_oil_well_pad"],"rules":["Vertical process equipment and interconnecting pipe racks must dominate the central process zone.","Storage alone cannot dominate the site; visible transformation/process infrastructure is mandatory.","The flare stack is isolated from the denser process core to preserve a distinct safety-zone silhouette."]},"circulation":{"heavy_vehicle":"peripheral_loading_route","service_vehicle":"process_access_grid","pedestrian":"controlled_internal"},"vanilla_representation":{"block_policy":"vanilla_only","emphasis":"silhouette_and_zone_legibility"}}
